title,keywords,abstract,authors,journal,links,raw_title,mindate,maxdate,BERT_input,topic,pred_val
Validation 3d finite element models simulated dxa images biofidelic simulations sideways fall impact hip.,"biomechanics, fracture risk assessment, orthopedics, statistical appearance models, statistical shape model, validation","Computed tomography (ct)-derived finite element (fe) models proposed tool improve current clinical assessment osteoporosis personalized hip fracture risk providing accurate estimate femoral strength. however, solution two main drawbacks, namely: (i) 3d ct images needed, whereas 2d dual-energy x-ray absorptiometry (dxa) images generally available, (ii) quasi-static femoral strength predicted surrogate fracture risk, instead predicting whether fall would result fracture not. aim study combine biofidelic fall simulation technique, based 3d computed tomography (ct) data algorithm reconstructs 3d femoral shape bmd distribution 2d dxa image. approach evaluated 11 pelvis-femur constructs ct scans, ex vivo sideways fall impact experiments ct-derived biofidelic fe models available. simulated dxa images used reconstruct 3d shape bone mineral density (bmd) distribution left femurs registering projection statistical shape appearance model genetic optimization algorithm. 2d-to-3d reconstructed femurs meshed, resulting fe models inserted biofidelic fe modeling pipeline simulating sideways fall. median 2d-to-3d reconstruction error 1.02 mm shape 0.06 g/cm3 bmd 11 specimens. fe models derived simulated dxas predicted outcome falls terms fracture versus non-fracture accuracy ct-derived fe models. study represents milestone towards improved assessment hip fracture risk based widely available clinical dxa images.","Grassi L, Fleps I, Sahlstedt H, Väänänen SP, Ferguson SJ, Isaksson H, Helgason B,",Bone,"[URL=""https://www.ncbi.nlm.nih.gov/pubmed/33022451""]Validation of 3D finite element models from simulated DXA images for biofidelic simulations of sideways fall impact to the hip.[/URL]",Validation of 3D finite element models from simulated DXA images for biofidelic simulations of sideways fall impact to the hip.,12/31/2020,1/7/2021,"Validation 3d finite element models simulated dxa images biofidelic simulations sideways fall impact hip. Computed tomography (ct)-derived finite element (fe) models proposed tool improve current clinical assessment osteoporosis personalized hip fracture risk providing accurate estimate femoral strength. however, solution two main drawbacks, namely: (i) 3d ct images needed, whereas 2d dual-energy x-ray absorptiometry (dxa) images generally available, (ii) quasi-static femoral strength predicted surrogate fracture risk, instead predicting whether fall would result fracture not. aim study combine biofidelic fall simulation technique, based 3d computed tomography (ct) data algorithm reconstructs 3d femoral shape bmd distribution 2d dxa image. approach evaluated 11 pelvis-femur constructs ct scans, ex vivo sideways fall impact experiments ct-derived biofidelic fe models available. simulated dxa images used reconstruct 3d shape bone mineral density (bmd) distribution left femurs registering projection statistical shape appearance model genetic optimization algorithm. 2d-to-3d reconstructed femurs meshed, resulting fe models inserted biofidelic fe modeling pipeline simulating sideways fall. median 2d-to-3d reconstruction error 1.02 mm shape 0.06 g/cm3 bmd 11 specimens. fe models derived simulated dxas predicted outcome falls terms fracture versus non-fracture accuracy ct-derived fe models. study represents milestone towards improved assessment hip fracture risk based widely available clinical dxa images.",MODELING,73.0% MODELING; 16.9% TRAUMA/IMPACT
Backpack load sharing model evaluate lumbar hip joint contact forces shoulder borne hip belt assisted load carriage.,"back, biomechanics, load carriage, locomotion, movement simulation, musculoskeletal modeling, spine","Musculoskeletal injuries lumbar spine occur frequently among military service members associated heavy backpack loads. musculoskeletal modeling simulation facilitate biomechanical evaluation compare different backpack designs. developed backpack attachment model tuned represent various load distributions torso pelvis. generated walking simulations estimate muscle joint contact forces unloaded walking carrying 38 kg using shoulder-borne backpacks hip belt-assisted backpacks six u.s. marines. three-dimensional peak average lumbar (l4-l5) hip joint contact forces stance phase compared load condition. axial l4-l5 axial anterior hip joint contact forces greater backpack conditions compared unloaded condition. joint contact forces similar backpack conditions. future studies incorporating additional participants, walking conditions, backpack load distributions suggested model development backpack design evaluation.","Sturdy JT, Sessoms PH, Silverman AK,",Applied ergonomics,"[URL=""https://www.ncbi.nlm.nih.gov/pubmed/33011587""]A backpack load sharing model to evaluate lumbar and hip joint contact forces during shoulder borne and hip belt assisted load carriage.[/URL]",A backpack load sharing model to evaluate lumbar and hip joint contact forces during shoulder borne and hip belt assisted load carriage.,12/31/2020,1/7/2021,"Backpack load sharing model evaluate lumbar hip joint contact forces shoulder borne hip belt assisted load carriage. Musculoskeletal injuries lumbar spine occur frequently among military service members associated heavy backpack loads. musculoskeletal modeling simulation facilitate biomechanical evaluation compare different backpack designs. developed backpack attachment model tuned represent various load distributions torso pelvis. generated walking simulations estimate muscle joint contact forces unloaded walking carrying 38 kg using shoulder-borne backpacks hip belt-assisted backpacks six u.s. marines. three-dimensional peak average lumbar (l4-l5) hip joint contact forces stance phase compared load condition. axial l4-l5 axial anterior hip joint contact forces greater backpack conditions compared unloaded condition. joint contact forces similar backpack conditions. future studies incorporating additional participants, walking conditions, backpack load distributions suggested model development backpack design evaluation.",ERGONOMICS,46.4% ERGONOMICS; 45.5% MODELING
Locomotion activity effects survival amblyomma sculptum (acari: ixodidae) nymphs laboratory conditions.,"amblyomma sculptum, dispersion, locomotion, nymph, survival, walking behavior","Active locomotion ticks directly associated epidemiology tick-borne diseases, important implications interaction ticks hosts dispersion environment. attempt elucidate factors involved dispersion amblyomma sculptum, present work aimed characterize different aspects active locomotion a. sculptum nymphs laboratory conditions. end, nymphs placed string 70° inclination walking activity recorded daily along survival period. lifetime, ticks walked average 110 m. locomotion straight line nymphs changed direction 142 times throughout lifetimes. mean distance walked per experimental day 1.8 m, average walking distance changing direction 52 cm. distance walked per experimental day reduced time. survival ticks affected walking; resting nymphs survived 6 months, survival walked daily reduced approximately 62 days. results showed a. sculptum nymphs able cover distances 100 throughout lifetimes, walked short distances time constantly changed direction. behavior indicates ticks able disperse long distances means active locomotion.","Natividade UA, Pimenta AP, Cezar RSM, Pereira MH, Gontijo NF, Sant'Anna MRV, Pessoa GD, Koerich LB, Araujo RN,",Ticks and tick-borne diseases,"[URL=""https://www.ncbi.nlm.nih.gov/pubmed/33011439""]Locomotion activity and its effects on the survival of Amblyomma sculptum (Acari: Ixodidae) nymphs under laboratory conditions.[/URL]",Locomotion activity and its effects on the survival of Amblyomma sculptum (Acari: Ixodidae) nymphs under laboratory conditions.,12/31/2020,1/7/2021,"Locomotion activity effects survival amblyomma sculptum (acari: ixodidae) nymphs laboratory conditions. Active locomotion ticks directly associated epidemiology tick-borne diseases, important implications interaction ticks hosts dispersion environment. attempt elucidate factors involved dispersion amblyomma sculptum, present work aimed characterize different aspects active locomotion a. sculptum nymphs laboratory conditions. end, nymphs placed string 70° inclination walking activity recorded daily along survival period. lifetime, ticks walked average 110 m. locomotion straight line nymphs changed direction 142 times throughout lifetimes. mean distance walked per experimental day 1.8 m, average walking distance changing direction 52 cm. distance walked per experimental day reduced time. survival ticks affected walking; resting nymphs survived 6 months, survival walked daily reduced approximately 62 days. results showed a. sculptum nymphs able cover distances 100 throughout lifetimes, walked short distances time constantly changed direction. behavior indicates ticks able disperse long distances means active locomotion.",COMPARATIVE,66.4% COMPARATIVE; 9.4% EVOLUTION/ANTHROPOLOGY
Influence functional shoulder biomechanics mediator patient-reported outcomes following mastectomy breast reconstruction.,,"Postmastectomy breast reconstruction techniques differentially influence patient-reported physical psychosocial well-being. objective measures shoulder biomechanics, uniquely influenced reconstruction technique, may provide insight influence reconstruction technique patient-reported outcomes.","Leonardis JM, Lyons DA, Kidwell KM, Giladi AM, Lipps DB, Momoh AO,",Plastic and reconstructive surgery,"[URL=""https://www.ncbi.nlm.nih.gov/pubmed/33009332""]The Influence of Functional Shoulder Biomechanics as a Mediator of Patient-Reported Outcomes following Mastectomy and Breast Reconstruction.[/URL]",The Influence of Functional Shoulder Biomechanics as a Mediator of Patient-Reported Outcomes following Mastectomy and Breast Reconstruction.,12/31/2020,1/7/2021,"Influence functional shoulder biomechanics mediator patient-reported outcomes following mastectomy breast reconstruction. Postmastectomy breast reconstruction techniques differentially influence patient-reported physical psychosocial well-being. objective measures shoulder biomechanics, uniquely influenced reconstruction technique, may provide insight influence reconstruction technique patient-reported outcomes.",REHABILITATION,37.5% ORTHOPAEDICS/SURGERY; 34.7% JOINT/CARTILAGE
Design evaluation novel anti-reflux biliary stent cone spiral valve.,"anti-reflux, biliary stent, cone spiral valve, fluid-structure interaction model, mechanical simulation","Endoscopic placement biliary stent well-established palliative treatment biliary obstruction. however, duodenobiliary reflux stent placement common problem may lead dreadful complications. paper designed novel anti-reflux biliary stent cone spiral valve. fluid-structure interaction (fsi) simulations established evaluate efficiency anti-reflux stent comparing clinically applied standard stent. according stress distribution valve, fatigue performance stress concentration area analyzed. results show antegrade flow valve, cone spiral valve could stretch open realize adequate drainage normal physiological pressure biliary tract; duodenal reflux valve, valve would compressed close result nearly zero outlet flow rate. furthermore, anti-reflux stent achieved improved radial mechanical performance 2.7 times higher radial stiffness standard stent. finite element analysis (fea) also indicates compared standard stent, addition anti-reflux valve little negative effect flexibility stent. fatigue analysis results showed valve reliable. research provides new stent cone spiral valve proves technically feasible effective preventing duodenobiliary reflux ensuring antegrade bile flow without compromising biomechanical performances.","Wang Y, Song XF, Su YS, Xu XS,","Proceedings of the Institution of Mechanical Engineers. Part H, Journal of engineering in medicine","[URL=""https://www.ncbi.nlm.nih.gov/pubmed/32988290""]Design and evaluation of a novel anti-reflux biliary stent with cone spiral valve.[/URL]",Design and evaluation of a novel anti-reflux biliary stent with cone spiral valve.,12/31/2020,1/7/2021,"Design evaluation novel anti-reflux biliary stent cone spiral valve. Endoscopic placement biliary stent well-established palliative treatment biliary obstruction. however, duodenobiliary reflux stent placement common problem may lead dreadful complications. paper designed novel anti-reflux biliary stent cone spiral valve. fluid-structure interaction (fsi) simulations established evaluate efficiency anti-reflux stent comparing clinically applied standard stent. according stress distribution valve, fatigue performance stress concentration area analyzed. results show antegrade flow valve, cone spiral valve could stretch open realize adequate drainage normal physiological pressure biliary tract; duodenal reflux valve, valve would compressed close result nearly zero outlet flow rate. furthermore, anti-reflux stent achieved improved radial mechanical performance 2.7 times higher radial stiffness standard stent. finite element analysis (fea) also indicates compared standard stent, addition anti-reflux valve little negative effect flexibility stent. fatigue analysis results showed valve reliable. research provides new stent cone spiral valve proves technically feasible effective preventing duodenobiliary reflux ensuring antegrade bile flow without compromising biomechanical performances.",_REMOVE_,25.7% TISSUE/BIOMATERIAL; 22.6% CARDIOVASCULAR/CARDIOPULMONARY
Biomechanical assessment using production tables mast climbing work platforms.,"back injury, mast climbing work platform, postural stability, production table","Objective study assess impact using alternative mast climbing work platform (mcwp) designs trunk motion postural stability masonry workers performing bricklaying stepping tasks using conventional mcwp setting (i.e. step deck) well two types production tables (straight- l-shaped). trunk angles postural sway parameters twenty-five masonry workers recorded following tasks: (1) standing simulated mcwp laying bricks adjacent wall, (2) stepping onto step deck get position bricklaying task. results indicated use l-shaped production table resulted lowest trunk ranges motion significantly reduced workers' trunk angles three planes compared straight-shaped production table conventional approach using production table. data showed body sway velocity area significantly reduced using either one production tables. use production tables significantly reduced impact sway forces workers stepped main platform step deck. use production tables mcwps improved workers' postures overall stability, could reduce risk injury.","Pan CS, Ning X, Wimer B, Zwiener J, Kau TY,",Applied ergonomics,"[URL=""https://www.ncbi.nlm.nih.gov/pubmed/32987261""]Biomechanical assessment while using production tables on mast climbing work platforms.[/URL]",Biomechanical assessment while using production tables on mast climbing work platforms.,12/31/2020,1/7/2021,"Biomechanical assessment using production tables mast climbing work platforms. Objective study assess impact using alternative mast climbing work platform (mcwp) designs trunk motion postural stability masonry workers performing bricklaying stepping tasks using conventional mcwp setting (i.e. step deck) well two types production tables (straight- l-shaped). trunk angles postural sway parameters twenty-five masonry workers recorded following tasks: (1) standing simulated mcwp laying bricks adjacent wall, (2) stepping onto step deck get position bricklaying task. results indicated use l-shaped production table resulted lowest trunk ranges motion significantly reduced workers' trunk angles three planes compared straight-shaped production table conventional approach using production table. data showed body sway velocity area significantly reduced using either one production tables. use production tables significantly reduced impact sway forces workers stepped main platform step deck. use production tables mcwps improved workers' postures overall stability, could reduce risk injury.",ERGONOMICS,99.6% ERGONOMICS; 0.1% POSTURE/BALANCE
Functional chopart's amputation tendon transfers.,"choparts, amputation, biomechanics, tendon balancing","Generally, forefoot osteomyelitis treated reliable level amputation transmetatarsal level. however, osteomyelitis extends proximal midfoot presents significant peripheral arterial disease, generally thought next best functional level amputation transtibial amputation. mostly part due high failure rate chopart's amputations attributed poor biomechanical tendon balancing. present new technique tendon balancing chopart's amputation results optimized ambulatory function, durable soft tissue envelope amputation, successful limb salvage.","Green CJ, Bibbo C, McArdle A, Knight C,",The Journal of foot and ankle surgery : official publication of the American College of Foot and Ankle Surgeons,"[URL=""https://www.ncbi.nlm.nih.gov/pubmed/32981826""]A Functional Chopart's Amputation With Tendon Transfers.[/URL]",A Functional Chopart's Amputation With Tendon Transfers.,12/31/2020,1/7/2021,"Functional chopart's amputation tendon transfers. Generally, forefoot osteomyelitis treated reliable level amputation transmetatarsal level. however, osteomyelitis extends proximal midfoot presents significant peripheral arterial disease, generally thought next best functional level amputation transtibial amputation. mostly part due high failure rate chopart's amputations attributed poor biomechanical tendon balancing. present new technique tendon balancing chopart's amputation results optimized ambulatory function, durable soft tissue envelope amputation, successful limb salvage.",HAND/FINGER/FOOT/TOE,62.0% HAND/FINGER/FOOT/TOE; 28.9% ORTHOPAEDICS/SURGERY
Biomechanical comparison hook plate vs headless compression screw fixation large fifth metatarsal base avulsion fractures.,"avulsion fracture, biomechanical study, compression screw, fifth metatarsal, hook plate, zone 1",Debate exists optimum fixation construct large avulsion fractures fifth metatarsal base. compared biomechanical strength 2 headless compression screws vs hook plate fixation fractures.,"Bean BA, Smyth NA, Abbasi P, Parks BG, Hembree WC,",Foot & ankle international,"[URL=""https://www.ncbi.nlm.nih.gov/pubmed/32981339""]Biomechanical Comparison of Hook Plate vs Headless Compression Screw Fixation of Large Fifth Metatarsal Base Avulsion Fractures.[/URL]",Biomechanical Comparison of Hook Plate vs Headless Compression Screw Fixation of Large Fifth Metatarsal Base Avulsion Fractures.,12/31/2020,1/7/2021,Biomechanical comparison hook plate vs headless compression screw fixation large fifth metatarsal base avulsion fractures. Debate exists optimum fixation construct large avulsion fractures fifth metatarsal base. compared biomechanical strength 2 headless compression screws vs hook plate fixation fractures.,HAND/FINGER/FOOT/TOE,88.0% HAND/FINGER/FOOT/TOE; 10.3% ORTHOPAEDICS/SURGERY
Effects hospital bed features physical stresses caregivers repositioning patients bed.,"hospital bed features, musculoskeletal disorders, patient handling, patient repositioning, physical stress","Repositioning patients bed common patient handling activity associated musculoskeletal disorders caregivers. hospital bed features may mitigate risk injury. current study investigated effect bed features physical stress caregivers. ten nurses recruited perform three repositioning activities. hand forces recorded, spine loading estimated using dynamic biomechanical model. results demonstrated except peak l5/s1 compressive load turning task, use assistive features significantly reduced physical stresses repositioning activities. however, recommended thresholds injury still exceeded many conditions. compared spinal load, hand force much higher relative injury thresholds, suggesting greater risk shoulder upper extremity injuries low back injury. mechanical lift equipment remains safest robust way reposition patient.","Zhou J, Wiggermann N,",Applied ergonomics,"[URL=""https://www.ncbi.nlm.nih.gov/pubmed/32977144""]The effects of hospital bed features on physical stresses on caregivers when repositioning patients in bed.[/URL]",The effects of hospital bed features on physical stresses on caregivers when repositioning patients in bed.,12/31/2020,1/7/2021,"Effects hospital bed features physical stresses caregivers repositioning patients bed. Repositioning patients bed common patient handling activity associated musculoskeletal disorders caregivers. hospital bed features may mitigate risk injury. current study investigated effect bed features physical stress caregivers. ten nurses recruited perform three repositioning activities. hand forces recorded, spine loading estimated using dynamic biomechanical model. results demonstrated except peak l5/s1 compressive load turning task, use assistive features significantly reduced physical stresses repositioning activities. however, recommended thresholds injury still exceeded many conditions. compared spinal load, hand force much higher relative injury thresholds, suggesting greater risk shoulder upper extremity injuries low back injury. mechanical lift equipment remains safest robust way reposition patient.",ERGONOMICS,99.1% ERGONOMICS; 0.2% POSTURE/BALANCE
Evaluation midface statistical shape modeling.,,"Aim investigation generate statistical shape model (ssm) midface evaluate symmetry, gender aspects, bone thickness.","Hierl T, Doerfler HM, Huempfner-Hierl H, Kruber D,",Journal of oral and maxillofacial surgery : official journal of the American Association of Oral and Maxillofacial Surgeons,"[URL=""https://www.ncbi.nlm.nih.gov/pubmed/32971060""]Evaluation of the Midface by Statistical Shape Modeling.[/URL]",Evaluation of the Midface by Statistical Shape Modeling.,12/31/2020,1/7/2021,"Evaluation midface statistical shape modeling. Aim investigation generate statistical shape model (ssm) midface evaluate symmetry, gender aspects, bone thickness.",DENTAL/ORAL/FACIAL,61.9% DENTAL/ORAL/FACIAL; 16.4% MODELING
Biomechanical agreement different imitation jumps hill jumps ski jumping.,"3d kinematics, hill jumps and imitation jumps, ski jumping, take-off","Even though take-off ski jumping decisive, athletes limited number training trials actual ski jump practice real ski jump conditions. hence, various imitation jumps aiming mimic hill jump performed daily training. imitation jumps therefore mimic kinematic pattern hill jumps appropriately. study aimed identify imitation jumps resemble hill jumps regarding four performance-related biomechanical criteria: maximal vertical take-off velocity, maximal knee extension velocity, maximal forward-directed angular momentum anterior shift center mass. therefore, three-dimensional analysis take-off six different modalities imitation jumps well hill jumps validation carried nine professional ski jumpers. imitation jumps rolling platform show better agreement stationary jumps three four parameters best resembled via imitation jump included ski jumping boots. thus, non-hill take-off training performed complex imitation jumps mimic actual ski jump. except vertical take-off velocity, could identify one imitation jump type statistically different hill. consequently, individual deficiencies athletes addressed specifically trained using appropriate imitation jump. information similarity imitation jumps real hill jumps highly relevant trainers athletes order effectively design training programs.","Ketterer J, Gollhofer A, Lauber B,",Scandinavian journal of medicine & science in sports,"[URL=""https://www.ncbi.nlm.nih.gov/pubmed/32969534""]Biomechanical agreement between different imitation jumps and hill jumps in ski jumping.[/URL]",Biomechanical agreement between different imitation jumps and hill jumps in ski jumping.,12/31/2020,1/7/2021,"Biomechanical agreement different imitation jumps hill jumps ski jumping. Even though take-off ski jumping decisive, athletes limited number training trials actual ski jump practice real ski jump conditions. hence, various imitation jumps aiming mimic hill jump performed daily training. imitation jumps therefore mimic kinematic pattern hill jumps appropriately. study aimed identify imitation jumps resemble hill jumps regarding four performance-related biomechanical criteria: maximal vertical take-off velocity, maximal knee extension velocity, maximal forward-directed angular momentum anterior shift center mass. therefore, three-dimensional analysis take-off six different modalities imitation jumps well hill jumps validation carried nine professional ski jumpers. imitation jumps rolling platform show better agreement stationary jumps three four parameters best resembled via imitation jump included ski jumping boots. thus, non-hill take-off training performed complex imitation jumps mimic actual ski jump. except vertical take-off velocity, could identify one imitation jump type statistically different hill. consequently, individual deficiencies athletes addressed specifically trained using appropriate imitation jump. information similarity imitation jumps real hill jumps highly relevant trainers athletes order effectively design training programs.",SPORT/EXERCISE,97.9% SPORT/EXERCISE; 0.3% METHODS
