title,keywords,abstract,authors,journal,links,raw_title,mindate,maxdate,BERT_input,topic,pred_val
Comparative analysis stress periodontal ligament center rotation tooth orthodontic treatment depending clear aligner thickness-finite element analysis study.,"aligner thickness, center of rotation, clear aligner, finite element analysis, principal stress","Lately, orthodontic treatments, use transparent aligners correction malocclusions become prominent owing intrinsic advantages esthetics, comfort, minimal maintenance. attempts improving upon technology varying various parameters investigate effects treatments carried several researchers. here, aimed investigate biomechanical clinical effects aligner thickness stress distributions periodontal ligament changes tooth's center rotation. dental finite element models comprising cortical cancellous bones, gingiva, teeth, nonlinear viscoelastic periodontal ligaments constructed, validated, used together aligner finite element models different aligner thicknesses achieve goal study. finite element analyses conducted simulate actual orthodontic aligner treatment process correction malocclusions generating pre-stresses aligner allowing aligner stresses relax induce tooth movement. results analyses showed orthodontic treatment lingual inclination axial rotation 0.75 mm-thick aligner resulted 6% 0.03% higher principal stresses periodontal ligament treatment using 0.05 mm-thick aligner, respectively. again, aligner thicknesses, tooth's center rotation moved lingually towards root direction lingual inclination, diagonally long axis tooth axial rotation. taken together, orthodontic treatment simple malocclusions using transparent aligners different thicknesses produce similar effect principal stresses periodontal ligament similar changes tooth's center rotation, well sufficient tooth movement. findings provide orthodontists researchers clinical biomechanical evidence effect transparent aligner thickness selection effect orthodontic treatment.","Seo JH, Eghan-Acquah E, Kim MS, Lee JH, Jeong YH, Jung TG, Hong M, Kim WH, Kim B, Lee SJ,","Materials (Basel, Switzerland)","[URL=""https://www.ncbi.nlm.nih.gov/pubmed/33435457""]Comparative Analysis of Stress in the Periodontal Ligament and Center of Rotation in the Tooth after Orthodontic Treatment Depending on Clear Aligner Thickness-Finite Element Analysis Study.[/URL]",Comparative Analysis of Stress in the Periodontal Ligament and Center of Rotation in the Tooth after Orthodontic Treatment Depending on Clear Aligner Thickness-Finite Element Analysis Study.,01/06/2021,01/13/2021,"Comparative analysis stress periodontal ligament center rotation tooth orthodontic treatment depending clear aligner thickness-finite element analysis study. Lately, orthodontic treatments, use transparent aligners correction malocclusions become prominent owing intrinsic advantages esthetics, comfort, minimal maintenance. attempts improving upon technology varying various parameters investigate effects treatments carried several researchers. here, aimed investigate biomechanical clinical effects aligner thickness stress distributions periodontal ligament changes tooth's center rotation. dental finite element models comprising cortical cancellous bones, gingiva, teeth, nonlinear viscoelastic periodontal ligaments constructed, validated, used together aligner finite element models different aligner thicknesses achieve goal study. finite element analyses conducted simulate actual orthodontic aligner treatment process correction malocclusions generating pre-stresses aligner allowing aligner stresses relax induce tooth movement. results analyses showed orthodontic treatment lingual inclination axial rotation 0.75 mm-thick aligner resulted 6% 0.03% higher principal stresses periodontal ligament treatment using 0.05 mm-thick aligner, respectively. again, aligner thicknesses, tooth's center rotation moved lingually towards root direction lingual inclination, diagonally long axis tooth axial rotation. taken together, orthodontic treatment simple malocclusions using transparent aligners different thicknesses produce similar effect principal stresses periodontal ligament similar changes tooth's center rotation, well sufficient tooth movement. findings provide orthodontists researchers clinical biomechanical evidence effect transparent aligner thickness selection effect orthodontic treatment.",DENTAL/ORAL/FACIAL,98.9% DENTAL/ORAL/FACIAL; 0.2% MODELING
Impact activity-based therapy respiratory outcomes medically complex child.,"activity-based therapy, cervical injury, development, pediatrics, respiration, spinal cord injury, trunk control",Activity-based therapies (abts) focus activating neuromuscular system level spinal cord injury (sci) promoting neuromuscular capacity.,"Goode-Roberts M, Bickel SG, Stout DL, Calvery ML, Thompson JE, Behrman AL,","Children (Basel, Switzerland)","[URL=""https://www.ncbi.nlm.nih.gov/pubmed/33435403""]Impact of Activity-Based Therapy on Respiratory Outcomes in a Medically Complex Child.[/URL]",Impact of Activity-Based Therapy on Respiratory Outcomes in a Medically Complex Child.,01/06/2021,01/13/2021,Impact activity-based therapy respiratory outcomes medically complex child. Activity-based therapies (abts) focus activating neuromuscular system level spinal cord injury (sci) promoting neuromuscular capacity.,REHABILITATION,48.8% ERGONOMICS; 42.7% REHABILITATION
Using accelerometer data tune parameters extended kalman filter optical motion capture: preliminary application gait analysis.,"kalman filter, gait analysis, inertial sensor, motion capture","Optical motion capture currently popular method acquiring motion data biomechanical applications. however, presents number problems make process difficult inefficient, marker occlusions unwanted reflections. addition, obtained trajectories must numerically differentiated twice time order get accelerations. since trajectories normally noisy, need filtered first, selection optimal amount filtering trivial. work, extended kalman filter (ekf) manages marker occlusions undesired reflections robust way presented. preliminary test inertial measurement units (imus) carried determine local reference frames. then, gait analysis healthy subject performed using optical markers imus simultaneously. filtering parameters used optical motion capture process tuned order achieve good correlation obtained accelerations measured imus. results show ekf provides robust efficient method optical system-based motion analysis, availability accelerations measured inertial sensors helpful adjustment filters.","Cuadrado J, Michaud F, Lugrís U, Pérez Soto M,","Sensors (Basel, Switzerland)","[URL=""https://www.ncbi.nlm.nih.gov/pubmed/33435369""]Using Accelerometer Data to Tune the Parameters of an Extended Kalman Filter for Optical Motion Capture: Preliminary Application to Gait Analysis.[/URL]",Using Accelerometer Data to Tune the Parameters of an Extended Kalman Filter for Optical Motion Capture: Preliminary Application to Gait Analysis.,01/06/2021,01/13/2021,"Using accelerometer data tune parameters extended kalman filter optical motion capture: preliminary application gait analysis. Optical motion capture currently popular method acquiring motion data biomechanical applications. however, presents number problems make process difficult inefficient, marker occlusions unwanted reflections. addition, obtained trajectories must numerically differentiated twice time order get accelerations. since trajectories normally noisy, need filtered first, selection optimal amount filtering trivial. work, extended kalman filter (ekf) manages marker occlusions undesired reflections robust way presented. preliminary test inertial measurement units (imus) carried determine local reference frames. then, gait analysis healthy subject performed using optical markers imus simultaneously. filtering parameters used optical motion capture process tuned order achieve good correlation obtained accelerations measured imus. results show ekf provides robust efficient method optical system-based motion analysis, availability accelerations measured inertial sensors helpful adjustment filters.",METHODS,97.7% METHODS; 1.3% GAIT/LOCOMOTION
Comprehensive hydrodynamic investigation zebrafish tail beats microfluidic device shape memory alloy.,"hydrodynamics, microfluidics, shape memory alloy (sma), tail beat, zebrafish","Zebrafish acknowledged reliable species choices biomechanical-related investigations. definite quantification hydrodynamic flow physics caused behavioral patterns, particularly zebrafish tail beat, critical comprehensive understanding food toxicity species, interpreted possible human responses. zebrafish's body size swimming speed place intermediate flow regime, viscous inertial forces play significant roles fluid-structure interaction. pilot work highlighted design development novel microfluidic device coupled shape memory alloy (sma) actuator immobilize zebrafish within observation region hydrodynamic quantification tail-beating behavioral responses, may induced overdose food additive exposure. study significantly examined behavioral patterns zebrafish early developmental stages, which, turn, generated vortex circulation. presented findings behavioral responses zebrafish hydrodynamic analysis provided golden protocol assess zebrafish animal model new drug discovery development.","Subendran S, Kang CW, Chen CY,",Micromachines,"[URL=""https://www.ncbi.nlm.nih.gov/pubmed/33435330""]Comprehensive Hydrodynamic Investigation of Zebrafish Tail Beats in a Microfluidic Device with a Shape Memory Alloy.[/URL]",Comprehensive Hydrodynamic Investigation of Zebrafish Tail Beats in a Microfluidic Device with a Shape Memory Alloy.,01/06/2021,01/13/2021,"Comprehensive hydrodynamic investigation zebrafish tail beats microfluidic device shape memory alloy. Zebrafish acknowledged reliable species choices biomechanical-related investigations. definite quantification hydrodynamic flow physics caused behavioral patterns, particularly zebrafish tail beat, critical comprehensive understanding food toxicity species, interpreted possible human responses. zebrafish's body size swimming speed place intermediate flow regime, viscous inertial forces play significant roles fluid-structure interaction. pilot work highlighted design development novel microfluidic device coupled shape memory alloy (sma) actuator immobilize zebrafish within observation region hydrodynamic quantification tail-beating behavioral responses, may induced overdose food additive exposure. study significantly examined behavioral patterns zebrafish early developmental stages, which, turn, generated vortex circulation. presented findings behavioral responses zebrafish hydrodynamic analysis provided golden protocol assess zebrafish animal model new drug discovery development.",METHODS,85.0% METHODS; 7.1% COMPARATIVE
Morphological behavioral effects zebrafish embryos exposure smoke dyes.,"disperse blue 14, solvent violet 47, anthraquinone dyes, behavior, zebrafish","Solvent violet 47 (sv47) disperse blue 14 (db14) two anthraquinone dyes previously used different formulations production violet-colored smoke. dyes shown potential toxicity; however, comprehensive understanding effects. zebrafish embryos exposed sv47 db14 6 120 h post fertilization (hpf) assess dyes' potential adverse effects developing embryos. potential ability dyes cross blood-brain barrier also assessed. concentrations 0.55 5.23 mg/l, sv47 showed dose-dependent increase mortality, jaw malformation, axis curvature, edemas. concentrations 0.15 7.54 mg/l, db14 dose-dependence similar morphological outcomes highest doses. nevertheless, sv47 showed significant mortality 4.20 mg/l, significant mortality embryos exposed db14. regardless, decreased locomotor movement observed concentrations db14, suggesting adverse neurodevelopmental effect. overall, results showed similar concentrations, sv47 db14 caused different types phenotypic effects zebrafish embryos.","To KT, St Mary L, Wooley AH, Wilbanks MS, Bednar AJ, Perkins EJ, Truong L, Tanguay RL, Garcia-Reyero N,",Toxics,"[URL=""https://www.ncbi.nlm.nih.gov/pubmed/33435144""]Morphological and Behavioral Effects in Zebrafish Embryos after Exposure to Smoke Dyes.[/URL]",Morphological and Behavioral Effects in Zebrafish Embryos after Exposure to Smoke Dyes.,01/06/2021,01/13/2021,"Morphological behavioral effects zebrafish embryos exposure smoke dyes. Solvent violet 47 (sv47) disperse blue 14 (db14) two anthraquinone dyes previously used different formulations production violet-colored smoke. dyes shown potential toxicity; however, comprehensive understanding effects. zebrafish embryos exposed sv47 db14 6 120 h post fertilization (hpf) assess dyes' potential adverse effects developing embryos. potential ability dyes cross blood-brain barrier also assessed. concentrations 0.55 5.23 mg/l, sv47 showed dose-dependent increase mortality, jaw malformation, axis curvature, edemas. concentrations 0.15 7.54 mg/l, db14 dose-dependence similar morphological outcomes highest doses. nevertheless, sv47 showed significant mortality 4.20 mg/l, significant mortality embryos exposed db14. regardless, decreased locomotor movement observed concentrations db14, suggesting adverse neurodevelopmental effect. overall, results showed similar concentrations, sv47 db14 caused different types phenotypic effects zebrafish embryos.",COMPARATIVE,40.0% COMPARATIVE; 21.2% NEURAL
Lasso locomotion expands climbing repertoire snakes.,,"Diverse ways environments animals move correlated morphology1, morphology sufficient predict animals move behavioral innovations create new capacities. document new mode snake locomotion - 'lasso locomotion' - allows brown treesnake (boiga irregularis) ascend much larger smooth cylinders previously known behavior. lasso locomotion may facilitate exploiting resources might otherwise unobtainable contribute success impact highly invasive species. video abstract.","Savidge JA, Seibert TF, Kastner M, Jayne BC,",Current biology : CB,"[URL=""https://www.ncbi.nlm.nih.gov/pubmed/33434490""]Lasso locomotion expands the climbing repertoire of snakes.[/URL]",Lasso locomotion expands the climbing repertoire of snakes.,01/06/2021,01/13/2021,"Lasso locomotion expands climbing repertoire snakes. Diverse ways environments animals move correlated morphology1, morphology sufficient predict animals move behavioral innovations create new capacities. document new mode snake locomotion - 'lasso locomotion' - allows brown treesnake (boiga irregularis) ascend much larger smooth cylinders previously known behavior. lasso locomotion may facilitate exploiting resources might otherwise unobtainable contribute success impact highly invasive species. video abstract.",COMPARATIVE,91.5% COMPARATIVE; 3.3% EVOLUTION/ANTHROPOLOGY
Biogeography key influence distal forelimb variation horses cenozoic.,"equidae, geometric morphometrics, locomotion, metacarpal, ordinary procrustes analyses","Locomotion terrestrial tetrapods reliant interactions distal limb bones (e.g. metapodials phalanges). metapodial-phalangeal joint horse (equidae) limbs highly specialized, facilitating vital functions (shock absorption; elastic recoil). joint shape changed throughout horse evolution, potential drivers modifications quantitatively assessed. here, examine morphology forelimb metacarpophalangeal (mcp) joint horses extinct kin (palaeotheres) using geometric morphometrics disparity analyses, within phylogenetic context. also develop novel alignment protocol explores magnitude shape change time, correlated body mass diet. mcp shape poorly correlated mass diet proxies, although significant temporal correlations detected 0-1 myr intervals. clear division recovered new old world hipparionin mcp morphologies. significant changes mcp disparity high rates shape divergence observed great american biotic interchange, mcp joint becoming broad robust two separate monodactyl lineages, possibly exhibiting novel locomotor behaviour. large-scale study mcp joint shape demonstrates apparent capacity horses rapidly change distal limb morphology overcome discrete locomotor challenges new habitats.","MacLaren JA,",Proceedings. Biological sciences,"[URL=""https://www.ncbi.nlm.nih.gov/pubmed/33434465""]Biogeography a key influence on distal forelimb variation in horses through the Cenozoic.[/URL]",Biogeography a key influence on distal forelimb variation in horses through the Cenozoic.,01/06/2021,01/13/2021,"Biogeography key influence distal forelimb variation horses cenozoic. Locomotion terrestrial tetrapods reliant interactions distal limb bones (e.g. metapodials phalanges). metapodial-phalangeal joint horse (equidae) limbs highly specialized, facilitating vital functions (shock absorption; elastic recoil). joint shape changed throughout horse evolution, potential drivers modifications quantitatively assessed. here, examine morphology forelimb metacarpophalangeal (mcp) joint horses extinct kin (palaeotheres) using geometric morphometrics disparity analyses, within phylogenetic context. also develop novel alignment protocol explores magnitude shape change time, correlated body mass diet. mcp shape poorly correlated mass diet proxies, although significant temporal correlations detected 0-1 myr intervals. clear division recovered new old world hipparionin mcp morphologies. significant changes mcp disparity high rates shape divergence observed great american biotic interchange, mcp joint becoming broad robust two separate monodactyl lineages, possibly exhibiting novel locomotor behaviour. large-scale study mcp joint shape demonstrates apparent capacity horses rapidly change distal limb morphology overcome discrete locomotor challenges new habitats.",EVOLUTION/ANTHROPOLOGY,44.8% COMPARATIVE; 36.3% EVOLUTION/ANTHROPOLOGY
Implantable cardiac kirigami-inspired lead-based energy harvester fabricated enhanced piezoelectric composite film.,"kirigami, cardiac energy, composites, energy harvesting, implantable materials, piezoelectric films","Harvesting biomechanical energy power implantable electronics pacemakers attracting great attention recent years replaces conventional batteries provides sustainable energy solution. however, current energy harvesting technologies directly interact internal organs often lack flexibility conformability, usually require additional implantation surgeries impose extra burden patients. address issue, kirigami inspired energy harvester, seamlessly incorporated pacemaker lead using piezoelectric composite films reported, possesses great flexibility also requires additional implantation surgeries. lead-based device allows harvesting energy complex motion lead caused expansion-contraction heart. device's kirigami pattern designed optimized attain greatly improved flexibility validated via finite element method (fem) simulations, mechanical tensile tests, energy output tests device shows power output 2.4 µw. finally, vivo test using porcine model reveals device implanted heart straightforwardly generates voltages ≈0.7 v. work offers new strategy designing flexible energy harvesters power implantable electronics.","Xu Z, Jin C, Cabe A, Escobedo D, Gruslova A, Jenney S, Closson AB, Dong L, Chen Z, Feldman MD, Zhang JXJ,",Advanced healthcare materials,"[URL=""https://www.ncbi.nlm.nih.gov/pubmed/33434407""]Implantable Cardiac Kirigami-Inspired Lead-Based Energy Harvester Fabricated by Enhanced Piezoelectric Composite Film.[/URL]",Implantable Cardiac Kirigami-Inspired Lead-Based Energy Harvester Fabricated by Enhanced Piezoelectric Composite Film.,01/06/2021,01/13/2021,"Implantable cardiac kirigami-inspired lead-based energy harvester fabricated enhanced piezoelectric composite film. Harvesting biomechanical energy power implantable electronics pacemakers attracting great attention recent years replaces conventional batteries provides sustainable energy solution. however, current energy harvesting technologies directly interact internal organs often lack flexibility conformability, usually require additional implantation surgeries impose extra burden patients. address issue, kirigami inspired energy harvester, seamlessly incorporated pacemaker lead using piezoelectric composite films reported, possesses great flexibility also requires additional implantation surgeries. lead-based device allows harvesting energy complex motion lead caused expansion-contraction heart. device's kirigami pattern designed optimized attain greatly improved flexibility validated via finite element method (fem) simulations, mechanical tensile tests, energy output tests device shows power output 2.4 µw. finally, vivo test using porcine model reveals device implanted heart straightforwardly generates voltages ≈0.7 v. work offers new strategy designing flexible energy harvesters power implantable electronics.",METHODS,50.0% METHODS; 15.4% ROBOTICS
"Inverse dynamics, joint reaction forces loading musculoskeletal system: guidelines correct mechanical terms recommendations accurate reporting results.","actual, bone-on-bone, contact, intersegmental, net, resultant","Inverse dynamics routinely used biomechanics estimation loading musculoskeletal system problems terms definitions even official recommendations introduce artificial incorrect mechanical constructs justify arbitrary inappropriate terms. terminology problems lead confusion misinterpretations rather standardisation mechanically correct nomenclature accurate interpretation joint loading. perspective paper exposes flawed foundational premises constructs makes recommendations accurate reporting inverse dynamics outcomes musculoskeletal loading. inverse dynamics approach based free body diagrams include actual forces applied ('actual forces' approach) replacement actual forces equivalent resultant force moment ('resultant moments' approach). irrespective approach used model muscle forces, inverse dynamics outputs always include joint reaction forces representing interactions adjacent segments. different terms suggested distinguish calculated joint reaction forces two approaches 'net joint force', 'resultant force', 'intersegmental force' 'bone-on-bone force' inappropriate, misleading confusing. recommended refer joint reaction forces total partial using actual forces resultant moments approach, respectively.","Baltzopoulos V,",Sports biomechanics,"[URL=""https://www.ncbi.nlm.nih.gov/pubmed/33433300""]Inverse dynamics, joint reaction forces and loading in the musculoskeletal system: guidelines for correct mechanical terms and recommendations for accurate reporting of results.[/URL]","Inverse dynamics, joint reaction forces and loading in the musculoskeletal system: guidelines for correct mechanical terms and recommendations for accurate reporting of results.",01/06/2021,01/13/2021,"Inverse dynamics, joint reaction forces loading musculoskeletal system: guidelines correct mechanical terms recommendations accurate reporting results. Inverse dynamics routinely used biomechanics estimation loading musculoskeletal system problems terms definitions even official recommendations introduce artificial incorrect mechanical constructs justify arbitrary inappropriate terms. terminology problems lead confusion misinterpretations rather standardisation mechanically correct nomenclature accurate interpretation joint loading. perspective paper exposes flawed foundational premises constructs makes recommendations accurate reporting inverse dynamics outcomes musculoskeletal loading. inverse dynamics approach based free body diagrams include actual forces applied ('actual forces' approach) replacement actual forces equivalent resultant force moment ('resultant moments' approach). irrespective approach used model muscle forces, inverse dynamics outputs always include joint reaction forces representing interactions adjacent segments. different terms suggested distinguish calculated joint reaction forces two approaches 'net joint force', 'resultant force', 'intersegmental force' 'bone-on-bone force' inappropriate, misleading confusing. recommended refer joint reaction forces total partial using actual forces resultant moments approach, respectively.",METHODS,64.6% METHODS; 23.7% MODELING
Model studying biomechanical effects varying ratios collagen types iii cardiomyocytes.,"cardiac fibrosis, cardiomyocytes, cell morphology, collagen type-i, collagen type-iii, tensile stress","Develop novel model composed solely col col iii lower upper limits set include ratios col col iii 3:1 9:1 structural mechanical behavior resident cm studied. further, progression fibrosis due change ratios col i:col iii tested.","Roman B, Kumar SA, Allen SC, Delgado M, Moncayo S, Reyes AM, Suggs LJ, Chintalapalle R, Li C, Joddar B,",Cardiovascular engineering and technology,"[URL=""https://www.ncbi.nlm.nih.gov/pubmed/33432515""]A Model for Studying the Biomechanical Effects of Varying Ratios of Collagen Types I and III on Cardiomyocytes.[/URL]",A Model for Studying the Biomechanical Effects of Varying Ratios of Collagen Types I and III on Cardiomyocytes.,01/06/2021,01/13/2021,"Model studying biomechanical effects varying ratios collagen types iii cardiomyocytes. Develop novel model composed solely col col iii lower upper limits set include ratios col col iii 3:1 9:1 structural mechanical behavior resident cm studied. further, progression fibrosis due change ratios col i:col iii tested.",CARDIOVASCULAR/CARDIOPULMONARY,52.6% CARDIOVASCULAR/CARDIOPULMONARY; 27.5% MODELING
